Terracotta	Operational Infrastructure	With 2. 1 Million developers in more than 190 countries nationwide, 2. 5 Million deployments which include most of the Global 1000 companies, and 5PB+ data in-memory using Terracotta software, Terracotta has established itself as a respected and known provider of application scalability, availability, and performance software. With skilled engineers that lead the development of their software, the company has this software available as both open source projects and commercial products. Terracotta customers largely benefit from a wide array of Terracotta’s services and solutions including enterprise-class products and support and distributed caching. Its flagship product, the Enterprise Ehcache enhances the capabilities of Ehcache which is the de facto caching standard for enterprise Java.
TIBCO	Log Data Apps	TIBCO’s platform has a unique ability to seek, understand, and respond to real-time events. This platform transforms a business into an event-enabled enterprise that can meet the challenges of the 21st century. TIBCO Software Inc. is trusted by customers as a provider of infrastructure software that are used on-premise or in the cloud computing environments. The company takes pride on the “two-second advantage” that its platform provides: capturing the right information, at the right time, and acting on it preemptively for a more competitive edge. With offices around the world, TIBCO strives to offer customers with the best analytics tools to better understand the Big Data and clearly see what’s going on throughout their organizations for optimized operations.
Turn	Ad / Media Apps	We understand the problem: There’s a wealth of data out there, but converting it into results is a complex and cumbersome process. That’s where Turn comes in. We have the technology to deliver real-time data insights and amazing campaign performance. We can help you explore the big picture, piece by piece. Turn will change the way you make decisions by doing things differently. Turn is a close-knit team that thinks big and not afraid to develop ideas that reinvent and reinterpret what came before. This team values and fosters innovation that makes an impact; thus, a relentless pursuit of smart marketing decisions and brilliant campaign results exist.
Vertica	Analytics Infrastructure	Vertica is Powered by Technology, Focused on Customers. Founded in 2005, Vertica has now achieved its goal of revolutionizing the relational database industry; and this goal was achieved by building its new system from ground up. Vertica's purpose-built analytics platform allows companies to monetize data at the speed and scale needed for them to thrive in today's economy. Vertica's solutions were built to thrive in the technology of the modern age. Its platform delivers real-time insight to data, fastest time to value which makes it possible to monetize data in a matter of minutes, and maximized performance to get the most out of your analytic infrastructure development.
Visual. ly	Analytics and Visualization	With Visually, you can tell stories with data. It's a one-stop shop for data visualizations and infographics creation to drive traffic and amplify an enterprise's social media presence. Visually brings together the Data Nerds, Marketing Gurus, and Design Junkies according to their common interests. This company is a proud partner of the world's leading publications and brands. This data visualization services enables agencies to create shareable content, gain social distribution and centralize their central project development while creating branded experiences. Visually have more than 35,000 designers which enable it to cater to the needs of various brands, companies, and agencies.
VoltDb	Operational Infrastructure	VoltDB is a fully durable in-memory relational database that combines high-velocity data ingestion, real-time analytics, massive scalability and decisioning to solve critical velocity problems. This opens the gate for organizations to obtain new applications that will act on data at its point of maximum value. Businesses use VoltDB to narrow the gap between ingestion and decision from hours or minutes, to milliseconds. For VoltDB, "Time is the Enemy of Data" giving emphasis that the moment it's created, data has its own enormous value that may lessen an hour from now and perhaps, no value tomorrow. The solutions provided by VoltDB are utilized by businesses in the financial services and web media markets, as well as public utilities and national defense.
Omer Trajman	Vertical Apps	WibiData is helping organizations build Big Data Applications. We provide technology and services to help our customers use data to improve their application experience. Our solutions are the product of the hard work and collaboration of a talented staff, world-class investors, and amazing customers and partners.
