Domo	Business Intelligence	Domo's CEO Josh James and his team of experts are some of the most sought after professionals in the industry with backgrounds in popular sites that include Amazon, Ancestry. com, Facebook, LinkedIn, and Salesforce. com among others. The company works with the ultimate goal of "transforming the way business executives manage their businesses and drive value from the tens of billions of dollars that other companies spend on traditional business intelligence systems. " These companies benefit from Domo's combined executive management platform and relentless focus on customer empowerment to make them successful. They simply understand the meaning of delivering software as a service.
Gnip	Data as a service
Ellucian	Vertical Apps	Educational institutions can thrive in an open and dynamic world. Ellucian aims to help these institutions achieve this goal. With a broad expertise in global education community collaboration, strategic guidance to deal with changes and technology solutions, Ellucian is trusted by more than 2,400 institutions in 40 countries worldwide to develop insights that will move education forward and help people discover their futures through learning. Ellucian draws on the collective insight of the global education community that enables it to provide innovative and flexible solutions, as well as provide sound and strategic guidance. Their wide array of solutions include Ellucian Student Management, Analytics, Student Success, Ellucian Community Engagement, Ellucian Mobile, Ellucian Services, Product Roadmaps, and more.
Emcien Corporation	Vertical Apps	Emcien’s automatic pattern-detection engine converts data to actionable insight that organizations can use immediately. Emcien breaks through time, cost and scale barriers that limit the ability to operationalize the value of data for mission-critical applications. Our patented algorithms recognize what's important, defocus what's not, evaluate all possible combinations and deliver the optimal results automatically. Emcien's engine, fueled by several highly competitive NSF grants and years of research at Georgia Tech and MIT, is delivering unprecedented value to organizations across sectors that depend on immediate insight for success—banking, healthcare, insurance, retail, Intelligence and others. Visit emcien. com to learn more.
Exasol	Analytics Infrastructure	Exasol is the home of Excellent Data Experts. This German software company targets to help B2B companies on their business intelligence applications by offering a high-speed and high-performance database. It's the top company in Central Europe that works to develop a database management system which is capable of running rapid data analysis and evaluation, making it the only supplier of high performance databases made in Germany. EXASolution is utilized for Data Warehousing, Data Mining, Big Data and Cloud Computing, and Web Analytics. The company holds various awards and recognition which include the Big Data Award 2012 (3rd place), Magic Quadrant 2012, Cool Vendor Report 2011, TPC-H Benchmark 2011, Innovation Price 2008 (Innovative Product), and the European IST Prize.
Factual	Data as a service	Gil Elbaz, co-founder of Applied Semantics, driven by his belief that accessible data will enable more innovative tools and applications, founded Factual in 2007. It's an open data platform that works to maximize data accessibility, accuracy, and transparency. Factual delivers definitely global data access that will power web and mobile applications, enterprise solutions, and mobile advertising. As its name implies, Factual's mission is to deliver "clean and structured data with complete transparency to developers, via both download and API access on liberal terms. "
FICO	Data as a service	FICO was introduced in 1956 as the pioneer in analytic solutions like credit scoring, predictive analystics, business rules management and optimization. Its credit scoring solutions have made credit more available not only in the United States but worldwide. FICO's groundbreaking use of mathematical analysis to for consumer behavior prediction transformed the industries and changed the way of product marketing and risk management. Aside from individual clients who seek assitance for managing their personal credit health, FICO is trusted by top banks, businesses, and government agencies with regards to risk control and reduction, solutions to accelerate growth, boost profits, and meet regulatory and competitive demands.
Gnip	Data as a service	Gnip is your Social Media API. It is the largest provider of social media data to businesses, so that they'll never miss a tweet, post, comment or like. In 2010, Twitter partnered with Gnip to become the very first provider of enterprise-grade access to an entire firehose of Tweets. The people behind Gnip work with a mission of making the ever-expanding world of social media data available to everyone through consistent and reliable architecture; thus, making the world realize the full potential of this amazingly vast information. 8 of the 9 largest social media monitoring businesses and 90% of the Fortune 500 companies obtain their social media data through Gnip. The company is highly trusted as a provider of enormous stream of social media data having the most resources, most customers, and the most robust infrastructure.
Gooddata	Business Intelligence	We connect business people with the data they need to make better decisions. For business users, that means operational dashboards that put key metrics and reports front-and-center in your daily business life. For the technical people, it’s an entirely new way to deliver BI for your company. GoodData will turn your data into dollars. This company provides a brand new solution to broken Business Intelligence through GoodData Bashes. This generates on-demand reports of disparate data which allows users to make intelligent business decisions based on all the data represented together in one place. Bases will track, segment, target, correlate, funnel, and compare data for the ultimate Business Intelligence advantage.
Greenplum	Analytics Infrastructure	Greenplum was acquired by EMC in July 2010, making it the foundation of EMC's Big Data Division. It offers breakthrough products which enhance the skills of data science teams, helping organizations reach business agility. Greenplum's Unified Analytics Platform combines the co-processing of structured and unstructured data using a productivity engine which allows for collaboration among data science team. Greenplum is managed by people who have acquired vast technical and enterprise expertise from companies like Amazon, Oracle, Microsoft, and Yahoo. Its products which include the Greenplum Analytics Lab, Database, Data Computing Appliance, and Greenplum HD among others, embody the power of cloud computing, virtualization, social collaboration, and open systems.
Hadapt	Analytics Infrastructure	Hadapt has developed a big data analytic platform which integrates SQL with Apache Hadoop, the only one in the industry. This enables customers to analyze all data in a single platform where no connectors, rigid structure, or complexities are necessary. The technology used by Hadapt started as a research done by co-founders Dr. Daniel Abadi and PhD student Kamil Bajda-Pawlikowski in Yale's Computer Science department. Hadapt's flagship product, the Adaptive Analytics Platform, delivers a native implementation of SQL to the Apache Hadoop open source project. Hadapt allows interactive SQL-based analysis of huge data sets by combining the robust and more scalable architecture of Hadoop with a hybrid storage layer that includes a relational data store.
Hadoop	Technologies	Hadoop is used for research and production by various companies and organizations. Through the Apache Hadoop Project, an open-source software for reliable, scalable, and distributed computing will be developed. The Apache Hadoop software library, a framework for distributed processing of large data sets across clusters of computers, was designed to scale up to single servers to thousands of machines that have their own computation and storage. Instead of relying on hardware to provide high availability, Apache Hadoop's library was designed to detect and handle failures at the application layer. This helps it to deliver a highly-available service that's on top of a group of computers, each of which may be prone to failures. The project includes Hadoop Common, Hadoop Distributed File System, Hadoop Yarn, and Hadoop MapReduce.
Hortonworks	Analytics Infrastructure	Hortonworks Data Platform is an open source Hadoop Distribution which is ideal for organizations that seek to combine Apache Hadoop's cost effectiveness and power with the advanced services and reliability needed for business deployments. Hadoop is the leading platform for storing, managing, processing and analyzing big data. Hortonworks was formed by the key architects, builders and operators from the Yahoo! Hadoop Software Engineering team that the effort to design and build every major release of the very first Apache Hadoop to the most current stable release that contributes more than 80% of the code along the way. Hortonworks focuses on ensuring that all capabilities required to make Apache Hadoop Enterprise Grade are developed and accessible in the Open Source community such as Data Services, Operational Services, and Platform Services.
IBM	Business Intelligence	IBM's social business delivers real value. IBM is a globally integrated technology and consulting company based in Armonk, New York. It operates in more than 170 countries. It's managed by the most talented people that help clients solve problems and have an edge among businesses, governments and non-profits. If IBM's social business delivers real value. The company works to help people reach success by providing innovative ideas, products, and services and by nurturing a strong relationship with clients. it guides customers to a smarter planet where there are new perspectives, new ways of working, and new solutions across industries. These solutions include Cloud Computing, Smarter Analytics, Smarter Commerce, Social Business, Mobile Enterprise, Security and Resiliency, PureSystems and PureData, and Smarter Computing. The company works to help people reach success by providing innovative ideas, products, and services and by nurturing a strong relationship with clients. They guide customers to a smarter planet where there are new perspectives, new ways of working, and new solutions across industries. These solutions include Cloud Computing, Smarter Analytics, Smarter Commerce, Social Business, Mobile Enterprise, Security and Resiliency, PureSystems and PureData, and Smarter Computing.
IBM DB2	Structured Databases	IBM's DB2 Database Software provides industry leading performance, reliability, and scale on any types of platform including Linux, Unix, and Windows. The DB2 delivers unparalleled efficiency for staffing and storage, and allows users to connect desktop and palm-top apps to mainframe and minicomputer host databases. DB2's technology provides a clear competitive advantage through it its continued improvements in SQL, XML and integrated business intelligence capabilities. DB2's SQL compatibility feature enables customers to migrate more easily from Oracle. It has the ability to slash the time and effort needed to move applications from one database to another. Proof to DB2's effectiveness is the huge number of big companies utilizing it. In fact, Coca-Cola, the largest independent company in the United States has been using DB2 10 to drive increased performance and lower software and hardware costs.
InfoBright	Analytics Infrastructure	Enterprises, SaaS and software companies, financial services, and telecommunications use Infobright for rapid analysis of critical business data. Infobright is also known for its Knowledge Grid intelligence that's combined with a columnar database, used to deliver fast query response with an unmatched administrative simplicity. This solution requires no indexes, no data partitioning, and no manual tuning. Through the years of delivering business solutions, Infobright has various recognitions which include: 2008 High Performance Data Warehousing Partner of the Year by Pentaho, Economic Data Warehouse Choice by Ventana Research, MySQL Partner of the Year 2009, Cool Vendor in Data Management and Integration 2009 by Gartner, Inc. , and Company to Watch in 2010 for Information Management given by Intelligent Enterprise.
InfoChimps	Infrastructure As A Service	Infochimps aims to "make the world's data more accessible for everyone". It's a privately-held, venture backed company headquartered in Austin, Texas. With the primary goal of providing the world access to structured data, Infochimps makes data more usable, accessible, and valuable with tools and systems that help make data management and access easier. Infochimps takes pride on its two products, the Infochimps Platform which is a scalable solutions for handling (build, manage, optimize) complex Big Data environments, and the Infochimps Data Marketplace which presents thousands of proprietary and public data sets which are available for both API access and download.
Informatica	Analytics Infrastructure	Informatica is the world's top independent provider of data integration software and services. Thousands of businesses worldwide trust Informatica's data integration, data quality and big data solutions in order to access, integrate, as well as trust their information assets residing on premise and in the Cloud. This enables businesses and organizations to stay ahead in today’s competitive global information economy. With the vision of “maximizing the return on data and delivering new revenue and unique competitive differentiation to businesses”, Informatica has received various awards such as the AppExchange Best of 2012 for Data Integration, Candidate Experience Award 2012, 2012 Business and Technology Innovation Award by Business Value Magazine, and 2012 Cloud Computing Innovation Award by Cloud Computing China Congress among others.
Inrix	Data as a service	When it comes to traffic information, driver services and directions, applications and tools to market traffic-powered solutions rapidly, clients seek the assistance of INRIX. The company works to give customers the power to go anywhere by intelligently combining the best traffic data with auto manufacturers, transportation agencies, game-changing technologies, and fleet and internet companies to set themselves apart. INRIX allows businesses to create compelling applications that have superior accuracy and coverage across more than 30 countries. With INRIX's dynamic traffic and travel service content, modern development tools and strategic partnerships worldwide, businesses can race to the top of the competition.
Jaspersoft	Business Intelligence	Jaspersoft is the most flexible, cost effective, and widely used Business Intelligence software in the world. It empowers millions of people every day to make decisions faster by delivering them actionable and timely data inside their applications and business processes by  way of an embeddable, cost effective analytics and reporting platform. Jaspersoft's open source business intelligence software has more than 14,000,000 product downloads worldwide, 175,000 production deployments and more than 14,000 commercial clients in 100 countries. It's a provider of the most flexible, widely deployed and cost effective business intelligence suite in the world. This helps companies in making better decision-making with the use of highly interactive dashboards, analyses, and web-based reports.
JSMapreduce	Infrastructure As A Service	JSMapreduce is the simplest full-featured Big Data infrastructure available. Founded by an early Google engineer, JSMapreduce requires no client installation or compilation. And it is the first truly debuggable Mapreduce solution. You develop your Big Data app as a mapreduction directly in the browser (using Python or Javascript), test it in the browser, then deploy to the cloud to run at scale. If anything goes wrong, you can debug the problem mapper or reducer shard right back in the browser. It's all automatic. JSMapreduce is fully transparent. Developing and testing your app in-browser is free. When running in the cloud, you get second-by-second updates on progress and cost.
Kaggle	Data as a service	With data science, you can participate and create competitions. Kaggle offers companies with a cost-effective method to harness the so-called “cognitive surplus” of data scientists. Kaggle itself is a community of thousands of data scientists (PhD's) from various quantitative fields including econometric, math, physics, computer science, and statistics. The company takes pride for being the leading platform for predictive modeling competitions. It is an arena where individuals can compare their data science skills against a global cadre half of experts in machine learning, statistics, and mathematics. It is also a platform for data prediction competitions that allows organizations to share their data and have it scrutinized by the world's best data scientists. It has achieved extraordinary results which outperformed betting markets. It also runs private, invitation-only competitions with all the data involved are subject to non-disclosure agreement.
Karmasphere	Analytics and Visualization	“Turn Big Data into Big Insight. ” Karmasphere provides a comprehensive and collaborative work space for Big Data teams. The company delivers a fully leveraged world of Big Data Analytics, allowing individuals and businesses to benefit from new innovations in technology using their existing skills and applications. Karmasphere is where businesses can make use of their resources to “quickly” and "effectively" obtain the actionable insight from Big Data which will delight customers and get them on top of the competition. It caters to leading and big players in the field of business and technology such as Intel, comScore, and HP among others.
vitria	Log Data Apps	Vitria Technology, Inc. provides the industry’s leading Operational Intelligence platform, empowering partners and customers alike to develop innovative Operational Intelligence solutions to analyze Big Data, complex events and business processes in the proper context and take real-time action. The result is faster, better decision-making. With a rich heritage as a BPM technology pioneer, Vitria’s award-winning process integration solutions provide the backbone for many Global 2000 companies’ mission-critical business processes. Vitria has customers in North America, South America, Europe, Asia and Australia.
Knoema	Data as a service	Knoema is your Personal Knowledge Highway. It’s a knowledge platform that operates by connecting data with analytics and presentation tools to develop one uniformed platform that will allow users to get access to, present, and share any data-driven content. Knoema uses a data use cycle which involves (1. ) accessing data from various sources, (2. ) collecting relevant indicators into a common space, (3. ) visualizing figures, (4. ) applying analytic functions, (5. ) creating dashboards, and (6. ) presenting the outcome. They offer various easy-to-use tools including forecast tracking tool, find your number, agriculture 101, Health Care business and investment in emerging markets, find your number - Africa, and find your number - U. S. Travel.
Kognitio	Analytics Infrastructure	Kognitio was the first to deliver in-memory analytical platform in 1989. In order to provide the highest level of scalable compute power, Kognitio's analytical platform was designed from the ground up. The software can be used in the Kognitio Cloud, a secure, private/public cloud Platform-as-a-Service. This allows the rapid execution of complex analytical queries without using the administrative overhead of manipulating data. Kognitio redefines the market as the industry's fastest, most affordable and most scalable analytical platform. It sets new standards in analytical processing and business intelligence with its improve in-memory analytical capability and unprecedented speeds to access and query data. It's available as a software solution on industry standard servers, a fully configured analytical appliance or on demand via the Kognitio Cloud. It's a ready-to-use, pay-as-you-go, analytical platform offering.
Lexis Nexis	Data as a service	LexisNexis believes in the notion that if information and technology are placed into the right hands, people will be given the power to shape the world. As a leading global provider of content-enabled workflow solutions, LexisNexis unites proprietary brand, premium information sources, and advanced web technologies by way of information and technology integration. The company aids various agencies such as law enforcement, accounting, risk management, government, corporate, legal, and academic markets by providing risk and analytics solutions in order to identify risk, verify identity, comply with legislation, conduct background screening, prevent fraud, as well as support law enforcement and homeland security initiatives.
Loggly	Log Data Apps	Loggly is the world’s most popular, cloud-based log management service which delivers application intelligence. This is a startup company based in San Francisco which develops a cloud-based logging platform that provides great value for organizations. Loggly’s log management and analysis service can handle massive amounts of unstructured data, offer real-time data analytics and map reduce capabilities, and allow users to search and archive data. Loggly enables users to understand how website traffic and capacity impact application performance to improve user experience in real-time, helps troubleshoot application development and deployment to catch bugs, exceptions and issues with built-in root cause analysis. Their system monitoring eliminates application issues and threats before they become fires; custom alerts reduce downtime if they do.
Loqate	Data as a service	New applications that harness the information in the big data, location-based services, market intelligence and customer analytics need the accuracy and intelligence that only comes from great address quality. This solution is provided by Loqate. It's located in San Bruno, California with sales and support offices in Europe and Asia-Pacific. Loqate is a valuable tool for capturing, verifying, and geocoding any address worldwide. Using Loqate's market leading entity extraction that's used in intelligence, forensics and internet search, location data from web pages, news feeds, Big Data or text can be identified and geocoded. Loqate partners with leading vendors in the industry including Microsoft, Oracle, IBM, and Data Innovations among others.
Lucky Sort	Ad / Media Apps	With its team's experience in the fields of health care, finance, academia, and forensic data analysis, Lucky Sort makes use of visualizations and the statistics of language to empower knowledge workers. These Advanced Information Interface Specialists take pride in the TopicWatch Visual Interface that's designed to allow domain experts the ability to analyze huge bodies of information like never before, with the use of basic analytical and research skills. LuckySort's TopicWatch shifts the atom of information consumption from individual documents to aggregate patterns. It enables the companies to summarize what people and other companies are saying in real-time, making you see the important trends before it's too late.
Mapr	Analytics Infrastructure	Delivering results on the promise of Hadoop, MapR was founded to make managing and analyzing Big Data a reality for all business users. MapR is an open, enterprise-grade distribution for Apache Hadoop. This award-winning MapR Distribution delivers unprecedented speed, ease of use, and dependability to Hadoop. It enables customers to harness the power of Big Data analytics by providing unparalleled data protection and business continuity. It's based in San Jose, California with investors that include Redpoint Ventures, Lightspeed Venture Partners, and NEA. MapR is used in industries including Healthcare, Manufacturing, Financial Services, Natural Resources, Transportation, Utilities, Government, Media and more.
MarkLogic	Operational Infrastructure	MarkLogic believes that "Next generation big data requires a next generation database. " Organizations that seek to drive revenue, manage risk, make the world safer and streamline operations rely on the powerful search and flexible application services, as well as Schema less Enterprise NoSQL database technology provided by MarkLogic. This makes MarkLogic the trusted platform for Big Data application for companies that look to increase revenue, manage risk, make the world safer, and streamline operations. It offers a powerful and complete platform to speed development, accessible and flexible solutions to ensure you see results fast, and reliable products to run the most mission-critical applications.
