1010data	Analytics and Visualization	For well over a decade, 1010data has pushed the limits of analytics on large amounts of data, including "Big Data". From routine reporting to advanced analytics, the 1010data system allows businesses like yours to hone their tactics and strategy, while reducing technology overhead, costs and risk. Its cloud-based analytics is used by hundreds of the world's largest retail, telecom, manufacturing, and financial services businesses. It has established a proven track record in delivering actionable insight from huge amount of data easily, quickly, and inexpensively compared to other solutions. The first big customer of 1010data was the New York Stock Exchange and today, more and more companies are experiencing  the huge advantage that 1010data's services and solutions offer.
10gen	Operational Infrastructure	10gen developed the leading NoSQL database, MongoDB, and offers production support, training, and consulting for the open source database. 10gen was founded by former DoubleClick Founder and CTO Dwight Merriman and former DoubleClick engineer and ShopWiki Founder and CTO Eliot Horowitz. Dwight and Eliot began development on MongoDB in 2007, drawing upon their experiences building large scale, high availability, robust systems. 10gen provides the free, cloud-based MongoDB Monitoring Service (MMS). It's a JSON-based, document-oriented data model that has dynamic schemas but at the same time preserves the relational databases' functionality (secondary indexes, aggregations, full query language, etc. ) and has an extensive driver support.
Aerospike	Operational Infrastructure	Aerospike is the only real-time NoSQL database built from the ground up to take advantage of this day's multi-core, multi-processor architectures and solid-state drives (SSDs). That's what makes it fast, running on 500k TPS per node with sub-millisecond latency. A hybrid architecture includes indexes in-memory and data either in-memory or on flash. Strong consistency and tightly coupled clusters that include auto replication, re-balancing, cross data center synchronization ensure reliable storage of billions of objects and terabytes of data. Native flash means fewer servers, less power, 17 times lower ops costs than with just DRAM. Visit Aerospike at www. aerospike. com to get started.
AgilOne	Vertical Apps	AgilOne delivers a "data scientist in the cloud". This replaces the traditional way of looking at marketing data. The company was founded out of the need of frustrated retail marketing leaders. AgilOne was born from its founders' passion in providing a better way to deal with data for effective marketing campaigns. It offers a fully-integrated marketing solution including marketing intelligence, predictive analytics, data management, and multi-channel campaign execution. These will help businesses understand customer behavior through a 360-degree perspective and enable these respective businesses to obtain new insights such as customer value in all channels and the effects that the touch points of multi-channel campaigns has on a company's revenue.
iponweb	Ad / Media Apps
Alteryx	Analytics and Visualization	Alteryx is dedicated to creating business intelligence (BI) technology that lets users easily invent smart and extensible software applications to solve data analysis problems and make decisions. We seek to inspire ingenuity in our customers and associates by bringing freedom, flexibility and creativity to insightful data management tools.
Altibase Inc. Structured Databases
Apache Hbase	Technologies	A data store that's designed after Google's BigTable: A Distributed Storage System for Structured Data, Apache HBase is a data hosting company which offers random and "real-time read or write access" to your Big Data. This open-source, distributed, versioned as well as column-oriented data store offers easy to use JAVA API access, strictly consistent read and writes, Block Cache and Bloom Filters for real-time queries, extensible JRuby-Based (JIRB) Shell, linear and modular scalability, automatic and configurable sharding of tables, automatic failover support between RegionServers, and support for exporting metrics via the Hadoop metrics subsystems to files or Ganglia among others.
Atigeo	Vertical Apps	By creating more data every second, our world also creates new possibilities. Atigeo's xPatterns platform is a tool for seizing them. Enterprise-grade and developer-ready xPatterns is hungry for big data, the wild and unruly information of our time. We created xPatterns to help you connect the most disparate data sources, discover insights and relationships you wouldn't even think to look for, and act on that intelligence - here and now - for the benefit of any purpose your information could serve. Today, data is more accessible than ever, and xPatterns works with data as it's found; structured or unstructured, siloed or scattershot.
Attivio	Business Intelligence	Attivio's Active Intelligence Engine™, the leading unified information access (UIA) platform, seamlessly indexes, joins and presents structured data and unstructured content. Attivio was created to deal with the long-standing Brotman all donations isolation for customer by integrating enterprise search, analytic capabilities to offer not just data but answers and intelligence as well. Attivio is a proud partner of business and IT leaders, independent software vendors, and system integrators to deal with the global business imperatives of today. Together, they develop insights to drive innovation and discover new opportunities, mitigate risks, and contain costs. The company has received various awards such as the Information Management's 40 Companies to Watch in 2011, KMWorld Trend-Setting Technology 2009-2010, and the Red Herring Global 100 in 2010.
Autonomy	Business Intelligence	Autonomy, an HP company, is a market-leading software company that helps organizations all over the world understand the meaning in information. A pioneer in its industry, Autonomy's unique meaning-based technology is able to make sense of and process unstructured, 'human information,' and draw real business value from that meaning.
Ayata	Analytics and Visualization	AYATA is the leader in Prescriptive Analytics. Prescriptive Analytics is the science of automatically synthesizing big data, mathematical sciences, business rules and machine learning to make smarter decisions about the future. Ayata's patent-pending technology can not only predict future outcomes, but also prescribe decision options and the impact of each option. Large corporations have a solid understanding of how their critical business processes have historically performed. However, they have had limited ability to use this understanding to make decisions about the future. Until now. AYATA is a Sanskrit word for "future". Our software that helps companies make smarter decisions about the future. AYATA's patent-pending technology can not only predict future outcomes of critical business processes, but also prescribe decision options and show the impact of each option. This technology, Prescriptive Analytics, is the "final phase" of analytics—combining predictions and decision-making, while taking into account the impact of the decisions. Today, AYATA is the only software company in the world with automated prescriptive analytics capability. AYATA (formerly DataInfoCom) was founded in 2003 to pioneer the complex R&D required to combine different disciplines of mathematical sciences, machine learning, and computer science for Prescriptive Analytics. Ayata began commercial operations in 2007, and Ayata 4. 0 is used by leading companies such as Dell, Cisco, and Microsoft.
Bime	Business Intelligence	Business Intelligence As-a-Service. BIME aims to "change the (data) world" by delivering business intelligence products that are based on state-of-the-art data visualization, innovative query axis, built in calculations and other ground-breaking cloud computing innovations. With business intelligence that's mostly too hard to use, too hard to manage, too hard to buy, and too hard to get it right, Bime was created to deliver an easy but powerful service for connecting to and analyzing data in any organization. With most of their clients being business people and power users, BIME packed a ton of added power to their dashboards to help clients express complex business logic without writing codes.
Birst	Business Intelligence	Agile Business Analytics. The name says it all. Birst provides the fastest way to answer your most pressing business questions and even questions that you didn't know to ask. As a company that's founded by Business Intelligence experts in 2005, the people behind Birst witnessed firsthand the power of enterprise-wide BI platforms. However, they have also observed that all the compelexities, fragmented offerings, and high costs has prevented the widespread adoption of these BI platforms. Thus, Birst was created to make way for powerful cloud-based technologies that provide enterprise-class analysis and reporting that's quick to deploy, easy to use, and affordable.
Bloom Reach	Ad / Media Apps	BloomReach’s Big Data marketing applications maximize online revenue by getting the most relevant products and services found on any platform. BloomReach’s Big Data marketing applications are powered by the first web-scale, big data Web Relevance Engine. This technology complements search marketing efforts by using and amplifying existing site content and increasing the “crawlability”, relevance and quality of every page and the site overall. BloomReach helps companies to capture all the business demands and get found. With the most innovative marketing innovations, BloomReach can effortlessly reveal the highest quality and relevant content so as to long-tail consumers that start their search, off your site.
Blue Fin Labs	Ad / Media Apps	Bluefin Labs is managed by people who have proven track records in the fields of business, communication, and technology. The company takes pride of its flagship product suite, the Bluefin Signals, which puts new and actionable analytics at the fingertips of brands, agencies, and TV networks. Bluefin offers a much clearer way to understand and assess the social TV analytics field by bringing the entire social TV landscape into focus by way of data gathered from both TV shows and TV commercials. Bluefine Labs is a recognized name in the Social TV Analytics industry with recognitions like 2012's Social TV Award for Best Research Platform, 2011 ad:tech Innovation Award, one of the Most Innovative Technology Companies of 2012, Digital 25: Leaders in Emerging Entertainment, and FASTech 50: Most Innovative Start-Ups.
BlueKai	Data as a service	BlueKai is the most interconnected media-independent data management platform, data exchange, and analytics system in the industry. As experts in big data ingestion, analysis and portability, we help you connect all your own data assets (with external data) and put it to use everywhere you need it to be. The result? Your business becomes more intelligent and efficient with EVERY interaction.
Business Objects	Business Intelligence	SAP Business Objects features strategic alignment, predictable performance, combined with confident decisions. It offers users a wide variety of applications and tools that will optimize business performance. This is achieved by connecting businesses, individuals, and information across business networks. SAP Business Objects offers solutions for large enterprises including SAP Business Objects Business Intelligence Solutions, SAPS Business Objects Explorer, Business Objects Information Management Solutions, Business Objects Enterprise Performance Management Solutions, and Business Objects Governance, Risk, and Compliance Solutions. For small and midsize businesses, there are the SAP Business Objects Edge solutions, SAP Crystal Reports, SAP Crystal and various Free Trials provided.
Calpont	Analytics Infrastructure	Calpont understands that regardless of size, information is a strategic asset that companies depend on for making decisions and to stay competitive. As a software company based in Frisco, Texas, Calpont is passionate about making powerful analytic database software available to everyone. Calpont is the place to go for fast, scalable, and easy to use analytic database software solution for success in building business intelligence, reporting, and read-intensive applications. InfiniDB Enterprise, Calpont's column database, can assist clients by servicing the big data needs of analytical applications which require performance, scalability and simplicity, as well as data warehouse and Business Intelligence.
Cassandra	Technologies	The Apache Cassandra project is the best-in-class when it comes to support for replicating across multiple data centers to make you survive regional outages; thus, it provides lower user latency and peace of mind. Offering a platform with linear scalability and proven fault-tolerance on commodity hardware or cloud infrastructure, Apache Cassandra database is the perfect choice when considering high availability of your mission-critical data without compromising performance. With Cassandra, there are no sing points of failure, no network bottlenecks, and every node in the cluster is identical. Users have control in choosing between synchronous or asynchronous replication for each update, and replication across multiple data centers is supported. Companies like eBay, Twitter, Reddit, Cisco, and Digg utilize Apache Cassandra.
Centrifuge	Analytics and Visualization	Taking your own data from anywhere, discovering patterns and relationships with Advanced Link Analysis, and Interactive Visualization & Collaborative Discovery, are the solutions offered by Centrifuge. Centrifuge Visual Network Analytics is utilized in the most demanding applications in the world such as cyber-security, homeland defense, retail theft, financial crimes analysis, insurance claims fraud and counter-terrorism. Centrifuge can bring your data from any source, filter and combine them as desired, and quickly make connections between people, behavior and events using its visual dashboards. Interactive Visualizations move beyond the simple and conventional dashboard to give user the ability to intepret big and small data within their businesses' context, and share findings with paten-pending Collaborative Discovery.
Cetas	Analytics and Visualization	Cetas is the Fastest Path from Data to Business Insights. It provides the industry's first Big Data  analytics solution by offering unique Instant Intelligence for online businesses. It brings real-time next-generation analytics for online streaming  application data, Hadoop, and various Big Data sources to online businesses and enterprises. Instant visibility and precise business insights are delivered by Ceta's recommendation engine, unique data clustering engine, data discovery/pattern extraction and real-time data navigation. Businesses that need to gain insight to user behavior with business analytics, segment users and products with cohort analytics, and perform sophisticated  business data modeling utilize Ceta's expertise for offering scalable platform, intelligent algorithms, and machine learning techniques. The company's  portfolio includes complex projects with strengths in Hadoop/Map Reduce, database and search technologies,  UI/visualization distributed systems and virtualization, NoSQL, and machine learning and clustering algorithms.
Chart. io	Business Intelligence	It's a "Beautiful Intelligence". Chartio was designed for the business and built for data, making it work with the world's most popular data sources. Giving utmost importance to how people interact with data, from setup to visualization to drawing insights, Chartio works to build the best interface data for all. Chartio is based in San Francisco and managed by people who like business, data, gorgeous interfaces, and aim to change the way the world looks at data. It's a venture-backed company that's born in YCombinator, having their Series A led by fine folks and industry experts from Avaoln Ventures and Bullpen Capital in October 2011.
Cirro	Analytics and Visualization	Founded in 2010 by Stuart Frost, a highly successful, serial high-tech entrepreneur, Cirro changes the way of companies make use of data by empowering non-technical analysts to perform complex analysis on BIG Data as well as traditional data sources. This is accomplished with the simplicity of using Excel or other in-house business intelligence tools. Cirro provides users with the opportunity to "ask questions" about their data for more informed data exploration and decision-making. With more than 20 years of experience in the technology industry, Mr. Frost has now a highly-skilled and experienced management team based in San Juan Capistrano, CA.
Clearstory	Analytics and Visualization	ClearStory Data makes big data work for the business. The company is managed by experts that aim to dramatically simplify accessing, exploring and analyzing data by offering a modern approach to data analysis using solutions that innovate on how data is discovered, analyzed, and consumed by businesses in the corporate, web and premium data sources. It changes the way big data is consumed by delivering combined, differentiated, and up-to-date insights. With the increasing distribution and decentralization of modern data, ClearStory's solution also modernizes data analysis through presenting a new user model for companies to easily discover, analyze and use data at scale from the corporate, premium and web data sources. This yields combined and up-to-date insights.
Cloudera	Analytics Infrastructure	Cloudera develops open-source software for a world dependent on Big Data. With Cloudera, businesses and other organizations can now interact with the world's largest data sets at the speed of thought — and ask bigger questions in the pursuit of discovering something incredible. It's the leader in Apache Hadoop-based services and software which enables it to provide a new and powerful data platform. This helps businesses to examine their data (structured and unstructured), and seek for answers for their unprecedented insights. Cloudera's solutions are provided in various industries such as telecommunications, media, advertising, web, retail, bioinformatics, university research, and financial services.
Cognos	Business Intelligence	From business intelligence to financial performance and strategy management to analytics applications, IBM Cognos software can provide what your organization needs to become top-performing and analytics-driven. With products for the individual, work group, department, midsize business and large enterprise, Cognos software is designed to help everyone in your organization make the decisions that achieve better business outcomes—for now and in the future. Choose the business intelligence or performance management product you want and be confident that it can grow seamlessly as your needs expand. IBM's Cognos Software includes the Cognos Express, Cognos Insight, Cognos Controller, Cognos Platform, Cognos FSR, and Cognos Disclosure Management among others.
Collective_i	Ad / Media Apps	Collective[i] is a pioneer in delivering enterprise-wide analyses which were curated and developed by the world's leading data scientists directly to business users. The company was founded in 2007 in New York City by a group of experienced executives: Tad Martin,  Heidi Messer and Stephen Messer. It offers Business Intelligence through a Software-as-a-Service model. Recognizing that most organizations lacked the infrastructure to "listen" to clients, measure the collective efforts of their team and quantify real revenues, Collective[i]'s  founders created the first data-driven network which  transforms raw data into shared strategic knowledge. Collective[i] offers access to a complete enterprise of stack technologies, ETL, data warehouse, data integration, data model, data mining and collaboration, and visualization engine among others.
Continuuity	Infrastructure As A Service	Continuuity delivers the industry’s first Big Data application fabric, fueling the next generation of Big Data applications by making it fast and easy for any developer to build, deploy, scale and manage Big Data apps. Built by developers for developers, Continuuity offers a unified experience across the entire application lifecycle from development to DevOps. Continuuity provides pre-packaged building blocks with higher level APIs, Data Libs, tooling and documentation that make creating Big Data applications blazing fast. The cloud-based Continuuity AppFabric™, the next generation application serving platform, is built on top of open source components and shields developers from the complexity of Big Data and cloud infrastructure. With visually rich UIs, elastic scalability at the touch of a button and push-button app deployment from the developer's local machine to the cloud, Continuuity shifts the focus from infrastructure creation to business value creation. Built by a team that has worked on and run some of the biggest, most sophisticated Big Data systems in the world, Continuuity is the future of Big Data application development.
Couchbase	Operational Infrastructure	It's always scalable, always fast, and always on. Based in Mountain View, California with sales and development offices worldwide, Couchbase is widely known for its consistently high performance, flexible data model, easy scalability, and availability that's 24 hours a day, 365 days a year. It's an open source noSQL database that functions for interactive web and mobile applications. Having the Couchbase Open Source Project which is a vibrant community of developers and users of Couchbase document-oriented database technology, the company has established itself as the provider of servers for interactive web and mobile applications for popular companies like AOL, Zynga, Vodafone, LinkedIn, Starbucks, and more.
Data Sift	Data as a service	DataSift offers services to businesses that aim to build business by utilizing social data. With his desire to help various organizations to improve their understanding and use of Social Media, Nick Halstead started DataSift as an offshoot from the popular Twitter news feed service, TweetMeme. But after realizing Social Media's huge effect on businesses, Halstead created a platform that will help these businesses deal with Social Media by gathering social data. Companies use DataSift to identify Pulse of Public Opinion in real time, uncover trends from Twitter's history, build a complete target Audience Profile, and connect news with social conversation.
Data Xu	Ad / Media Apps	Data, Insight, and Action are what DataXu is all about. It's managed by the best minds that hailed from Silicon Valley, Wall Street, Madison Avenue and Academia. These people are experts in online advertising and digital media, building up companies, brand building, as well as advertising platform development. DataXu is a company which believes that 100% digital advertising will happen sooner than expected, and so it aims to collaborate with clients and co-invent a digital future. With the use of products like DX3, DataXu helps customers optimize their digital marketing and customer acquisition efforts through an unrivaled global scale and efficiency.
Datameer	Analytics and Visualization	Datameer offers analytics at the speed of business. Unlike conventional Business Intelligence, Datameer's single application does not require any static schemas and ETL; it's Data Integration, Data Analytics, and Data Visualization combined to form one powerful application. Since 2009 when it was founded by some of the original Apache Hadoop contributors, Datameer continues to grow as a global team that advances big data analytics. Unlike conventional Business Intelligence that requires complicated, multi-step, multi-vendor process and limited to a set of highly-trained users, Datameer simplifies the complex process for data analytics by providing a single application on top of the powerful Hadoop platform.
Dataspora	Analytics and Visualization	Dataspora leverages both proprietary and open-source tools to extract knowledge from high dimensional data sets. Rather than simply observing patterns and making predictions about the world around us, Dataspora takes business intelligence to the next level by learning what to do in order to change the world around us in the manner we desire.
Datastax	Operational Infrastructure	DataStax's massively scalable, flexible and always available big data platform was built on Apache Cassandra. It makes full use of Cassandra and Apache Hadoop for analytics and Apache Soir for search, across the various data centers in the cloud. At present, DataStax fuels the big data apps of leading companies like eBay, Netflix, and Adobe. They offer world-class products and services to help these big companies move faster in a complicated world of handling Big Data. Clients can benefit from DataStax Enterprise, DataStax Community, DataStax OpsCenter, and DataStax Enterprise for Startups with technologies that use Apache Cassandra, Hadoop and SoIr.
denis
